{
  "items": [
    {
      "return_id": "RET-000102",
      "order_id": "ORD-005230",
      "customer_id": "C-MARCO-1",
      "display_name": "Marco Bianchi",
      "requested_at": "2026-09-28T09:12:00Z",
      "reason": "changed_mind",
      "path": "withdrawal",
      "evidence_quality": "sufficient",
      "quadrant": "Q4",
      "decision_id": "DEC-000102-1",
      "state": "proposed",
      "requires_approval": true,
      "lever_ids": [
        "return_window_days:14",
        "free_return_shipping:false",
        "instant_refund:false",
        "coupons_enabled:false",
        "cluster_coupons_disabled:true",
        "transparency_notice:true"
      ],
      "review_at": "2026-12-27",
      "review_due": false,
      "refund_due_by": "2026-10-12",
      "refund_overdue": false,
      "risk": {
        "value": 0.87,
        "unit": "probability",
        "provenance": {
          "origin": "Contract example: risk model risk-xgb-0.1.0 on decision-time features of the synthetic shop",
          "period_start": "2025-10-01",
          "period_end": "2026-09-30",
          "nature": "synthetic"
        }
      },
      "value": {
        "value": 42.1,
        "unit": "eur",
        "provenance": {
          "origin": "Contract example: customer value, 12-month net margin (spec 8.5) of the synthetic shop",
          "period_start": "2025-10-01",
          "period_end": "2026-09-30",
          "nature": "synthetic"
        }
      },
      "expected_net_benefit": {
        "value": 123.5,
        "unit": "eur",
        "provenance": {
          "origin": "Contract example: economic simulator, unit costs of assumptions-v1 (spec 4 and 8.10)",
          "period_start": "2026-10-01",
          "period_end": "2027-09-30",
          "nature": "simulated"
        }
      },
      "linked_account_count": 6,
      "variant_anomaly": false,
      "draft_status": "ready"
    },
    {
      "return_id": "RET-000108",
      "order_id": "ORD-005508",
      "customer_id": "C-17305",
      "display_name": "Martina Gallo",
      "requested_at": "2026-09-29T12:12:00Z",
      "reason": "changed_mind",
      "path": "withdrawal",
      "evidence_quality": "sufficient",
      "quadrant": "Q3",
      "decision_id": "DEC-000108-1",
      "state": "proposed",
      "requires_approval": true,
      "lever_ids": [
        "instant_refund:false",
        "transparency_notice:true"
      ],
      "review_at": "2026-12-28",
      "review_due": false,
      "refund_due_by": "2026-10-13",
      "refund_overdue": false,
      "risk": {
        "value": 0.71,
        "unit": "probability",
        "provenance": {
          "origin": "Contract example: risk model risk-xgb-0.1.0 on decision-time features of the synthetic shop",
          "period_start": "2025-10-01",
          "period_end": "2026-09-30",
          "nature": "synthetic"
        }
      },
      "value": {
        "value": 239.55,
        "unit": "eur",
        "provenance": {
          "origin": "Contract example: customer value, 12-month net margin (spec 8.5) of the synthetic shop",
          "period_start": "2025-10-01",
          "period_end": "2026-09-30",
          "nature": "synthetic"
        }
      },
      "expected_net_benefit": {
        "value": 12.5,
        "unit": "eur",
        "provenance": {
          "origin": "Contract example: economic simulator, unit costs of assumptions-v1 (spec 4 and 8.10)",
          "period_start": "2026-10-01",
          "period_end": "2027-09-30",
          "nature": "simulated"
        }
      },
      "linked_account_count": 0,
      "variant_anomaly": false,
      "draft_status": "ready"
    },
    {
      "return_id": "RET-000106",
      "order_id": "ORD-005402",
      "customer_id": "C-10233",
      "display_name": "Chiara Esposito",
      "requested_at": "2026-09-29T11:12:00Z",
      "reason": "changed_mind",
      "path": "withdrawal",
      "evidence_quality": "sufficient",
      "quadrant": "Q3",
      "decision_id": "DEC-000106-1",
      "state": "proposed",
      "requires_approval": true,
      "lever_ids": [
        "instant_refund:false",
        "transparency_notice:true"
      ],
      "review_at": "2026-12-28",
      "review_due": false,
      "refund_due_by": "2026-10-13",
      "refund_overdue": false,
      "risk": {
        "value": 0.66,
        "unit": "probability",
        "provenance": {
          "origin": "Contract example: risk model risk-xgb-0.1.0 on decision-time features of the synthetic shop",
          "period_start": "2025-10-01",
          "period_end": "2026-09-30",
          "nature": "synthetic"
        }
      },
      "value": {
        "value": 433.75,
        "unit": "eur",
        "provenance": {
          "origin": "Contract example: customer value, 12-month net margin (spec 8.5) of the synthetic shop",
          "period_start": "2025-10-01",
          "period_end": "2026-09-30",
          "nature": "synthetic"
        }
      },
      "expected_net_benefit": {
        "value": 9.5,
        "unit": "eur",
        "provenance": {
          "origin": "Contract example: economic simulator, unit costs of assumptions-v1 (spec 4 and 8.10)",
          "period_start": "2026-10-01",
          "period_end": "2027-09-30",
          "nature": "simulated"
        }
      },
      "linked_account_count": 2,
      "variant_anomaly": false,
      "draft_status": "ready"
    }
  ],
  "total": 3,
  "page": 1,
  "page_size": 25,
  "sort": "-expected_net_benefit",
  "as_of": "2026-09-30T18:00:00Z",
  "provenance": {
    "origin": "Contract example: account graph graph-0.1.0 (spec 8.3) of the synthetic shop",
    "period_start": "2025-10-01",
    "period_end": "2026-09-30",
    "nature": "synthetic"
  }
}
